{
  "$schema": "https://json-schema.org/draft/2020-12/schema",
  "$id": "https://raw.githubusercontent.com/r5n-labs/clis/refs/heads/develop/packages/sisyphus/schema.json",
  "title": "Sisyphus configuration",
  "type": "object",
  "properties": {
    "$schema": { "type": "string" },
    "single": { "type": "boolean" },
    "tag": {
      "type": "string",
      "pattern": "^[A-Za-z][0-9A-Za-z._-]*$",
      "not": { "pattern": "^(?:[vV]?\\d+(?:\\.(?:\\d+|[xX*])){0,2}(?:-[0-9A-Za-z.-]+)?(?:\\+[0-9A-Za-z.-]+)?|[xX])$" }
    },
    "sisyphusDir": { "type": "string", "minLength": 1 },
    "stonesPath": { "type": "string", "minLength": 1 },
    "ignore": {
      "type": "array",
      "description": "Package names or globs that are never released. Globs use path semantics, so scoped names need '@scope/*' rather than '*'.",
      "items": { "type": "string", "minLength": 1 },
      "uniqueItems": true
    },
    "dependents": {
      "type": "object",
      "additionalProperties": false,
      "description": "How dependent packages are pulled into a release.",
      "properties": {
        "kinds": {
          "type": "array",
          "description": "Manifest sections whose workspace dependencies make a dependent releasable. Keep 'devDependencies' when packages are bundled at build time; drop it when only the published manifest matters.",
          "items": { "enum": ["dependencies", "devDependencies", "optionalDependencies", "peerDependencies"] },
          "uniqueItems": true
        },
        "updateInternal": {
          "enum": ["always", "outOfRange"],
          "description": "'always' releases every dependent; 'outOfRange' releases a dependent only when its published range no longer admits the new version. A literal 'workspace:<range>' is never rewritten by a release, so it never triggers one."
        }
      }
    },
    "plugins": { "type": "array", "items": { "type": "string" }, "uniqueItems": true },
    "stones": {
      "type": "array",
      "items": { "type": "string", "pattern": "^[0-9A-Za-z][0-9A-Za-z_-]*$" },
      "uniqueItems": true
    },
    "lastStone": {
      "type": "object",
      "additionalProperties": false,
      "properties": { "commit": { "type": "string" }, "date": { "type": "string" } }
    },
    "commit": {
      "type": "object",
      "additionalProperties": false,
      "properties": {
        "author": { "type": "string" },
        "email": { "type": "string", "pattern": "^[^\\s<>@]+@[^\\s<>@]+\\.[^\\s<>@]+$" },
        "message": { "type": "string", "minLength": 1 }
      }
    },
    "release": {
      "type": "object",
      "additionalProperties": false,
      "properties": {
        "build": {
          "type": "object",
          "additionalProperties": false,
          "description": "How package artifacts are built before packing.",
          "properties": {
            "command": {
              "type": "array",
              "description": "Argv for the per-package build, run in the package directory. An empty array disables it.",
              "items": { "type": "string", "minLength": 1 }
            },
            "outputs": {
              "type": "array",
              "description": "Repository-root-relative globs written by the release build. They are cleaned before the build and exempted from the ignored-input and pack-input guards.",
              "items": { "type": "string", "minLength": 1, "not": { "pattern": "^(\\.\\.?/|/)" } },
              "uniqueItems": true
            },
            "root": {
              "type": "array",
              "description": "Argv arrays run once at the repository root before the first package is packed.",
              "items": { "type": "array", "minItems": 1, "items": { "type": "string", "minLength": 1 } }
            }
          }
        },
        "createRelease": { "type": "boolean" },
        "npm": { "type": "boolean" },
        "npmVisibilityTimeout": {
          "type": "integer",
          "minimum": 0,
          "description": "Seconds to wait after npm publication for each released version to become visible with the published integrity. Versions still missing are reported as warnings without failing the release. 0 skips the check."
        },
        "push": { "type": "boolean" },
        "tags": { "type": "boolean" }
      }
    },
    "changelog": {
      "type": "object",
      "additionalProperties": false,
      "properties": {
        "append": { "type": "boolean" },
        "filename": { "type": "string", "minLength": 1 },
        "generate": { "type": "boolean" },
        "packageHeader": { "type": "string" },
        "root": { "type": "boolean" },
        "rootHeader": { "type": "string" },
        "template": { "type": "string" },
        "sections": {
          "type": "object",
          "additionalProperties": false,
          "properties": {
            "breaking": { "type": "string" },
            "build": { "type": "string" },
            "chore": { "type": "string" },
            "ci": { "type": "string" },
            "dependencies": { "type": "string" },
            "docs": { "type": "string" },
            "feat": { "type": "string" },
            "fix": { "type": "string" },
            "other": { "type": "string" },
            "perf": { "type": "string" },
            "refactor": { "type": "string" },
            "style": { "type": "string" },
            "test": { "type": "string" }
          }
        }
      }
    },
    "scripts": {
      "type": "object",
      "additionalProperties": false,
      "properties": {
        "pre": { "type": "object", "additionalProperties": { "type": "string" } },
        "post": { "type": "object", "additionalProperties": { "type": "string" } }
      }
    },
    "commits": {
      "type": "object",
      "additionalProperties": false,
      "properties": {
        "skip": {
          "type": "object",
          "additionalProperties": false,
          "properties": {
            "authors": { "type": "array", "items": { "type": "string" } },
            "messagePatterns": { "type": "array", "items": { "type": "string" } }
          }
        }
      }
    },
    "pr": {
      "type": "object",
      "additionalProperties": false,
      "properties": {
        "labelMapping": { "type": "object", "additionalProperties": { "enum": ["major", "minor", "patch"] } },
        "skip": {
          "type": "object",
          "additionalProperties": false,
          "properties": {
            "authors": { "type": "array", "items": { "type": "string" } },
            "labels": { "type": "array", "items": { "type": "string" } },
            "titlePatterns": { "type": "array", "items": { "type": "string" } }
          }
        }
      }
    },
    "currentRelease": {
      "type": "object",
      "additionalProperties": false,
      "properties": {
        "packages": {
          "type": "object",
          "additionalProperties": {
            "type": "object",
            "additionalProperties": false,
            "properties": {
              "oldVersion": { "type": "string", "minLength": 1 },
              "newVersion": { "type": "string", "minLength": 1 }
            }
          }
        },
        "planHash": { "type": "string", "pattern": "^[0-9a-f]{64}$" },
        "sourceHash": { "type": "string", "pattern": "^[0-9a-f]{64}$" },
        "stoneIds": {
          "type": "array",
          "items": { "type": "string", "pattern": "^[0-9A-Za-z][0-9A-Za-z_-]*$" },
          "uniqueItems": true
        },
        "timestamp": { "type": "string", "pattern": "^\\d{4}-\\d{2}-\\d{2}T\\d{2}-\\d{2}-\\d{2}-\\d{3}Z$" }
      }
    }
  }
}
